
2390001;Mar 16, 2012 18:05:10.030000000 EDT;192.168.202.78;80;192.168.204.60;38419;6;1500;TCP;80 → 38419 [ACK] Seq=103757889 Ack=495 Win=6912 Len=1448 TSval=38958081 TSecr=470476188 [TCP segment of a reassembled PDU]
2390002;Mar 16, 2012 18:05:10.030000000 EDT;192.168.202.78;80;192.168.204.60;38419;6;1500;TCP;[TCP Retransmission] 80 → 38419 [ACK] Seq=103757889 Ack=495 Win=6912 Len=1448 TSval=38958081 TSecr=470476188
2390003;Mar 16, 2012 18:05:10.030000000 EDT;192.168.202.78;80;192.168.204.60;38419;6;1500;TCP;80 → 38419 [ACK] Seq=103759337 Ack=495 Win=6912 Len=1448 TSval=38958081 TSecr=470476188 [TCP segment of a reassembled PDU]
2390004;Mar 16, 2012 18:05:10.030000000 EDT;192.168.202.78;80;192.168.204.60;38419;6;1500;TCP;[TCP Retransmission] 80 → 38419 [ACK] Seq=103759337 Ack=495 Win=6912 Len=1448 TSval=38958081 TSecr=470476188
2390005;Mar 16, 2012 18:05:10.030000000 EDT;192.168.202.78;80;192.168.204.60;38419;6;1500;TCP;80 → 38419 [ACK] Seq=103760785 Ack=495 Win=6912 Len=1448 TSval=38958081 TSecr=470476188 [TCP segment of a reassembled PDU]
2390006;Mar 16, 2012 18:05:10.030000000 EDT;192.168.202.78;80;192.168.204.60;38419;6;1500;TCP;[TCP Retransmission] 80 → 38419 [ACK] Seq=103760785 Ack=495 Win=6912 Len=1448 TSval=38958081 TSecr=470476188
2390007;Mar 16, 2012 18:05:10.030000000 EDT;192.168.202.78;80;192.168.204.60;38419;6;1500;TCP;80 → 38419 [ACK] Seq=103762233 Ack=495 Win=6912 Len=1448 TSval=38958081 TSecr=470476188 [TCP segment of a reassembled PDU]
2390008;Mar 16, 2012 18:05:10.030000000 EDT;192.168.202.78;80;192.168.204.60;38419;6;1500;TCP;[TCP Retransmission] 80 → 38419 [ACK] Seq=103762233 Ack=495 Win=6912 Len=1448 TSval=38958081 TSecr=470476188
2390009;Mar 16, 2012 18:05:10.040000000 EDT;192.168.202.78;80;192.168.204.60;38419;6;1500;TCP;80 → 38419 [ACK] Seq=103763681 Ack=495 Win=6912 Len=1448 TSval=38958081 TSecr=470476188 [TCP segment of a reassembled PDU]
2390010;Mar 16, 2012 18:05:10.040000000 EDT;192.168.202.78;80;192.168.204.60;38419;6;1500;TCP;[TCP Retransmission] 80 → 38419 [ACK] Seq=103763681 Ack=495 Win=6912 Len=1448 TSval=38958081 TSecr=470476188
2390011;Mar 16, 2012 18:05:10.040000000 EDT;192.168.202.78;80;192.168.204.60;38419;6;1500;TCP;80 → 38419 [ACK] Seq=103765129 Ack=495 Win=6912 Len=1448 TSval=38958081 TSecr=470476188 [TCP segment of a reassembled PDU]
2390012;Mar 16, 2012 18:05:10.040000000 EDT;192.168.202.78;80;192.168.204.60;38419;6;1500;TCP;[TCP Retransmission] 80 → 38419 [ACK] Seq=103765129 Ack=495 Win=6912 Len=1448 TSval=38958081 TSecr=470476188
2390013;Mar 16, 2012 18:05:10.040000000 EDT;192.168.202.78;80;192.168.204.60;38419;6;1500;TCP;80 → 38419 [ACK] Seq=103766577 Ack=495 Win=6912 Len=1448 TSval=38958081 TSecr=470476188 [TCP segment of a reassembled PDU]
2390014;Mar 16, 2012 18:05:10.040000000 EDT;192.168.202.78;80;192.168.204.60;38419;6;1500;TCP;[TCP Retransmission] 80 → 38419 [ACK] Seq=103766577 Ack=495 Win=6912 Len=1448 TSval=38958081 TSecr=470476188
2390015;Mar 16, 2012 18:05:10.040000000 EDT;192.168.202.78;80;192.168.204.60;38419;6;1500;TCP;80 → 38419 [ACK] Seq=103768025 Ack=495 Win=6912 Len=1448 TSval=38958084 TSecr=470476195 [TCP segment of a reassembled PDU]
2390016;Mar 16, 2012 18:05:10.040000000 EDT;192.168.202.78;80;192.168.204.60;38419;6;1500;TCP;[TCP Retransmission] 80 → 38419 [ACK] Seq=103768025 Ack=495 Win=6912 Len=1448 TSval=38958084 TSecr=470476195
2390017;Mar 16, 2012 18:05:10.040000000 EDT;192.168.202.78;80;192.168.204.60;38419;6;1500;TCP;80 → 38419 [ACK] Seq=103769473 Ack=495 Win=6912 Len=1448 TSval=38958084 TSecr=470476195 [TCP segment of a reassembled PDU]
2390018;Mar 16, 2012 18:05:10.040000000 EDT;192.168.202.78;80;192.168.204.60;38419;6;1500;TCP;[TCP Retransmission] 80 → 38419 [ACK] Seq=103769473 Ack=495 Win=6912 Len=1448 TSval=38958084 TSecr=470476195
2390019;Mar 16, 2012 18:05:10.040000000 EDT;192.168.202.78;80;192.168.204.60;38419;6;1500;TCP;80 → 38419 [ACK] Seq=103770921 Ack=495 Win=6912 Len=1448 TSval=38958084 TSecr=470476195 [TCP segment of a reassembled PDU]
2390020;Mar 16, 2012 18:05:10.040000000 EDT;192.168.202.78;80;192.168.204.60;38419;6;1500;TCP;[TCP Retransmission] 80 → 38419 [ACK] Seq=103770921 Ack=495 Win=6912 Len=1448 TSval=38958084 TSecr=470476195
2390021;Mar 16, 2012 18:05:10.040000000 EDT;192.168.202.78;80;192.168.204.60;38419;6;1500;TCP;80 → 38419 [ACK] Seq=103772369 Ack=495 Win=6912 Len=1448 TSval=38958084 TSecr=470476195 [TCP segment of a reassembled PDU]
2390022;Mar 16, 2012 18:05:10.040000000 EDT;192.168.202.78;80;192.168.204.60;38419;6;1500;TCP;[TCP Retransmission] 80 → 38419 [ACK] Seq=103772369 Ack=495 Win=6912 Len=1448 TSval=38958084 TSecr=470476195
2390023;Mar 16, 2012 18:05:10.040000000 EDT;192.168.202.78;80;192.168.204.60;38419;6;1500;TCP;80 → 38419 [ACK] Seq=103773817 Ack=495 Win=6912 Len=1448 TSval=38958084 TSecr=470476195 [TCP segment of a reassembled PDU]
2390024;Mar 16, 2012 18:05:10.040000000 EDT;192.168.202.78;80;192.168.204.60;38419;6;1500;TCP;[TCP Retransmission] 80 → 38419 [ACK] Seq=103773817 Ack=495 Win=6912 Len=1448 TSval=38958084 TSecr=470476195
2390025;Mar 16, 2012 18:05:10.040000000 EDT;192.168.202.78;80;192.168.204.60;38419;6;1500;TCP;80 → 38419 [ACK] Seq=103775265 Ack=495 Win=6912 Len=1448 TSval=38958084 TSecr=470476195 [TCP segment of a reassembled PDU]
2390026;Mar 16, 2012 18:05:10.040000000 EDT;192.168.202.78;80;192.168.204.60;38419;6;1500;TCP;[TCP Retransmission] 80 → 38419 [ACK] Seq=103775265 Ack=495 Win=6912 Len=1448 TSval=38958084 TSecr=470476195
2390027;Mar 16, 2012 18:05:10.040000000 EDT;192.168.202.78;80;192.168.204.60;38419;6;1500;TCP;80 → 38419 [ACK] Seq=103776713 Ack=495 Win=6912 Len=1448 TSval=38958084 TSecr=470476195 [TCP segment of a reassembled PDU]
2390028;Mar 16, 2012 18:05:10.040000000 EDT;192.168.202.78;80;192.168.204.60;38419;6;1500;TCP;[TCP Retransmission] 80 → 38419 [ACK] Seq=103776713 Ack=495 Win=6912 Len=1448 TSval=38958084 TSecr=470476195
2390029;Mar 16, 2012 18:05:10.040000000 EDT;192.168.202.78;80;192.168.204.60;38419;6;1500;TCP;80 → 38419 [ACK] Seq=103778161 Ack=495 Win=6912 Len=1448 TSval=38958084 TSecr=470476195 [TCP segment of a reassembled PDU]
2390030;Mar 16, 2012 18:05:10.040000000 EDT;192.168.202.78;80;192.168.204.60;38419;6;1500;TCP;[TCP Retransmission] 80 → 38419 [ACK] Seq=103778161 Ack=495 Win=6912 Len=1448 TSval=38958084 TSecr=470476195
2390031;Mar 16, 2012 18:05:10.040000000 EDT;192.168.202.78;80;192.168.204.60;38419;6;1500;TCP;80 → 38419 [ACK] Seq=103779609 Ack=495 Win=6912 Len=1448 TSval=38958084 TSecr=470476195 [TCP segment of a reassembled PDU]
2390032;Mar 16, 2012 18:05:10.040000000 EDT;192.168.202.78;80;192.168.204.60;38419;6;1500;TCP;[TCP Retransmission] 80 → 38419 [ACK] Seq=103779609 Ack=495 Win=6912 Len=1448 TSval=38958084 TSecr=470476195
2390033;Mar 16, 2012 18:05:10.040000000 EDT;192.168.202.78;80;192.168.204.60;38419;6;1500;TCP;80 → 38419 [ACK] Seq=103781057 Ack=495 Win=6912 Len=1448 TSval=38958084 TSecr=470476195 [TCP segment of a reassembled PDU]
2390034;Mar 16, 2012 18:05:10.040000000 EDT;192.168.202.78;80;192.168.204.60;38419;6;1500;TCP;[TCP Retransmission] 80 → 38419 [ACK] Seq=103781057 Ack=495 Win=6912 Len=1448 TSval=38958084 TSecr=470476195
2390035;Mar 16, 2012 18:05:10.040000000 EDT;192.168.202.78;80;192.168.204.60;38419;6;1500;TCP;80 → 38419 [ACK] Seq=103782505 Ack=495 Win=6912 Len=1448 TSval=38958084 TSecr=470476195 [TCP segment of a reassembled PDU]
2390036;Mar 16, 2012 18:05:10.040000000 EDT;192.168.202.78;80;192.168.204.60;38419;6;1500;TCP;[TCP Retransmission] 80 → 38419 [ACK] Seq=103782505 Ack=495 Win=6912 Len=1448 TSval=38958084 TSecr=470476195
2390037;Mar 16, 2012 18:05:10.040000000 EDT;192.168.202.78;80;192.168.204.60;38419;6;1500;TCP;80 → 38419 [ACK] Seq=103783953 Ack=495 Win=6912 Len=1448 TSval=38958084 TSecr=470476195 [TCP segment of a reassembled PDU]
2390038;Mar 16, 2012 18:05:10.040000000 EDT;192.168.202.78;80;192.168.204.60;38419;6;1500;TCP;[TCP Retransmission] 80 → 38419 [ACK] Seq=103783953 Ack=495 Win=6912 Len=1448 TSval=38958084 TSecr=470476195
2390039;Mar 16, 2012 18:05:10.040000000 EDT;192.168.202.78;80;192.168.204.60;38419;6;1500;TCP;80 → 38419 [ACK] Seq=103785401 Ack=495 Win=6912 Len=1448 TSval=38958084 TSecr=470476195 [TCP segment of a reassembled PDU]
2390040;Mar 16, 2012 18:05:10.040000000 EDT;192.168.202.78;80;192.168.204.60;38419;6;1500;TCP;[TCP Retransmission] 80 → 38419 [ACK] Seq=103785401 Ack=495 Win=6912 Len=1448 TSval=38958084 TSecr=470476195
2390041;Mar 16, 2012 18:05:10.040000000 EDT;192.168.202.78;80;192.168.204.60;38419;6;1500;TCP;80 → 38419 [ACK] Seq=103786849 Ack=495 Win=6912 Len=1448 TSval=38958084 TSecr=470476195 [TCP segment of a reassembled PDU]
2390042;Mar 16, 2012 18:05:10.040000000 EDT;192.168.202.78;80;192.168.204.60;38419;6;1500;TCP;[TCP Retransmission] 80 → 38419 [ACK] Seq=103786849 Ack=495 Win=6912 Len=1448 TSval=38958084 TSecr=470476195
2390043;Mar 16, 2012 18:05:10.040000000 EDT;192.168.202.78;80;192.168.204.60;38419;6;1500;TCP;80 → 38419 [ACK] Seq=103788297 Ack=495 Win=6912 Len=1448 TSval=38958084 TSecr=470476195 [TCP segment of a reassembled PDU]
2390044;Mar 16, 2012 18:05:10.040000000 EDT;192.168.202.78;80;192.168.204.60;38419;6;1500;TCP;[TCP Retransmission] 80 → 38419 [ACK] Seq=103788297 Ack=495 Win=6912 Len=1448 TSval=38958084 TSecr=470476195
2390045;Mar 16, 2012 18:05:10.040000000 EDT;192.168.202.78;80;192.168.204.60;38419;6;1500;TCP;80 → 38419 [ACK] Seq=103789745 Ack=495 Win=6912 Len=1448 TSval=38958084 TSecr=470476195 [TCP segment of a reassembled PDU]
2390046;Mar 16, 2012 18:05:10.040000000 EDT;192.168.202.78;80;192.168.204.60;38419;6;1500;TCP;[TCP Retransmission] 80 → 38419 [ACK] Seq=103789745 Ack=495 Win=6912 Len=1448 TSval=38958084 TSecr=470476195
2390047;Mar 16, 2012 18:05:10.040000000 EDT;192.168.202.78;80;192.168.204.60;38419;6;1500;TCP;80 → 38419 [ACK] Seq=103791193 Ack=495 Win=6912 Len=1448 TSval=38958084 TSecr=470476195 [TCP segment of a reassembled PDU]
2390048;Mar 16, 2012 18:05:10.040000000 EDT;192.168.202.78;80;192.168.204.60;38419;6;1500;TCP;[TCP Retransmission] 80 → 38419 [ACK] Seq=103791193 Ack=495 Win=6912 Len=1448 TSval=38958084 TSecr=470476195
2390049;Mar 16, 2012 18:05:10.040000000 EDT;192.168.202.78;80;192.168.204.60;38419;6;1500;TCP;80 → 38419 [ACK] Seq=103792641 Ack=495 Win=6912 Len=1448 TSval=38958084 TSecr=470476195 [TCP segment of a reassembled PDU]
2390050;Mar 16, 2012 18:05:10.040000000 EDT;192.168.202.78;80;192.168.204.60;38419;6;1500;TCP;[TCP Retransmission] 80 → 38419 [ACK] Seq=103792641 Ack=495 Win=6912 Len=1448 TSval=38958084 TSecr=470476195
2390051;Mar 16, 2012 18:05:10.040000000 EDT;192.168.202.78;80;192.168.204.60;38419;6;1500;TCP;80 → 38419 [ACK] Seq=103794089 Ack=495 Win=6912 Len=1448 TSval=38958084 TSecr=470476195 [TCP segment of a reassembled PDU]
2390052;Mar 16, 2012 18:05:10.040000000 EDT;192.168.202.78;80;192.168.204.60;38419;6;1500;TCP;[TCP Retransmission] 80 → 38419 [ACK] Seq=103794089 Ack=495 Win=6912 Len=1448 TSval=38958084 TSecr=470476195
2390053;Mar 16, 2012 18:05:10.040000000 EDT;192.168.204.60;38419;192.168.202.78;80;6;52;TCP;38419 → 80 [ACK] Seq=495 Ack=103348105 Win=524280 Len=0 TSval=470476195 TSecr=38958021
2390054;Mar 16, 2012 18:05:10.040000000 EDT;192.168.204.60;38419;192.168.202.78;80;6;52;TCP;[TCP Dup ACK 2390053#1] 38419 → 80 [ACK] Seq=495 Ack=103348105 Win=524280 Len=0 TSval=470476195 TSecr=38958021
2390055;Mar 16, 2012 18:05:10.040000000 EDT;192.168.202.78;80;192.168.204.60;38419;6;1500;TCP;80 → 38419 [ACK] Seq=103795537 Ack=495 Win=6912 Len=1448 TSval=38958084 TSecr=470476195 [TCP segment of a reassembled PDU]
2390056;Mar 16, 2012 18:05:10.040000000 EDT;192.168.204.60;38419;192.168.202.78;80;6;52;TCP;38419 → 80 [ACK] Seq=495 Ack=103351001 Win=524280 Len=0 TSval=470476196 TSecr=38958021
2390057;Mar 16, 2012 18:05:10.040000000 EDT;192.168.202.78;80;192.168.204.60;38419;6;1500;TCP;[TCP Retransmission] 80 → 38419 [ACK] Seq=103795537 Ack=495 Win=6912 Len=1448 TSval=38958084 TSecr=470476195
2390058;Mar 16, 2012 18:05:10.040000000 EDT;192.168.204.60;38419;192.168.202.78;80;6;52;TCP;[TCP Dup ACK 2390056#1] 38419 → 80 [ACK] Seq=495 Ack=103351001 Win=524280 Len=0 TSval=470476196 TSecr=38958021
2390059;Mar 16, 2012 18:05:10.040000000 EDT;192.168.202.78;80;192.168.204.60;38419;6;1500;TCP;80 → 38419 [ACK] Seq=103796985 Ack=495 Win=6912 Len=1448 TSval=38958084 TSecr=470476195 [TCP segment of a reassembled PDU]
2390060;Mar 16, 2012 18:05:10.040000000 EDT;192.168.204.60;38419;192.168.202.78;80;6;52;TCP;38419 → 80 [ACK] Seq=495 Ack=103353897 Win=524280 Len=0 TSval=470476196 TSecr=38958022
2390061;Mar 16, 2012 18:05:10.040000000 EDT;192.168.202.78;80;192.168.204.60;38419;6;1500;TCP;[TCP Retransmission] 80 → 38419 [ACK] Seq=103796985 Ack=495 Win=6912 Len=1448 TSval=38958084 TSecr=470476195
2390062;Mar 16, 2012 18:05:10.040000000 EDT;192.168.204.60;38419;192.168.202.78;80;6;52;TCP;[TCP Dup ACK 2390060#1] 38419 → 80 [ACK] Seq=495 Ack=103353897 Win=524280 Len=0 TSval=470476196 TSecr=38958022
2390063;Mar 16, 2012 18:05:10.040000000 EDT;192.168.204.60;38419;192.168.202.78;80;6;52;TCP;38419 → 80 [ACK] Seq=495 Ack=103356793 Win=524280 Len=0 TSval=470476197 TSecr=38958022
2390064;Mar 16, 2012 18:05:10.040000000 EDT;192.168.204.60;38419;192.168.202.78;80;6;52;TCP;[TCP Dup ACK 2390063#1] 38419 → 80 [ACK] Seq=495 Ack=103356793 Win=524280 Len=0 TSval=470476197 TSecr=38958022
2390065;Mar 16, 2012 18:05:10.040000000 EDT;192.168.202.78;80;192.168.204.60;38419;6;1500;TCP;80 → 38419 [ACK] Seq=103798433 Ack=495 Win=6912 Len=1448 TSval=38958084 TSecr=470476195 [TCP segment of a reassembled PDU]
2390066;Mar 16, 2012 18:05:10.040000000 EDT;192.168.202.78;80;192.168.204.60;38419;6;1500;TCP;[TCP Retransmission] 80 → 38419 [ACK] Seq=103798433 Ack=495 Win=6912 Len=1448 TSval=38958084 TSecr=470476195
2390067;Mar 16, 2012 18:05:10.040000000 EDT;192.168.204.60;38419;192.168.202.78;80;6;52;TCP;38419 → 80 [ACK] Seq=495 Ack=103371273 Win=524280 Len=0 TSval=470476198 TSecr=38958022
2390068;Mar 16, 2012 18:05:10.040000000 EDT;192.168.204.60;38419;192.168.202.78;80;6;52;TCP;[TCP Dup ACK 2390067#1] 38419 → 80 [ACK] Seq=495 Ack=103371273 Win=524280 Len=0 TSval=470476198 TSecr=38958022
2390069;Mar 16, 2012 18:05:10.040000000 EDT;192.168.202.78;80;192.168.204.60;38419;6;1500;TCP;80 → 38419 [ACK] Seq=103799881 Ack=495 Win=6912 Len=1448 TSval=38958084 TSecr=470476195 [TCP segment of a reassembled PDU]
2390070;Mar 16, 2012 18:05:10.040000000 EDT;192.168.202.78;80;192.168.204.60;38419;6;1500;TCP;[TCP Retransmission] 80 → 38419 [ACK] Seq=103799881 Ack=495 Win=6912 Len=1448 TSval=38958084 TSecr=470476195
2390071;Mar 16, 2012 18:05:10.040000000 EDT;192.168.202.78;80;192.168.204.60;38419;6;1500;TCP;80 → 38419 [ACK] Seq=103801329 Ack=495 Win=6912 Len=1448 TSval=38958084 TSecr=470476195 [TCP segment of a reassembled PDU]
2390072;Mar 16, 2012 18:05:10.040000000 EDT;192.168.204.60;38419;192.168.202.78;80;6;52;TCP;38419 → 80 [ACK] Seq=495 Ack=103374169 Win=524280 Len=0 TSval=470476199 TSecr=38958022
2390073;Mar 16, 2012 18:05:10.040000000 EDT;192.168.202.78;80;192.168.204.60;38419;6;1500;TCP;[TCP Retransmission] 80 → 38419 [ACK] Seq=103801329 Ack=495 Win=6912 Len=1448 TSval=38958084 TSecr=470476195
2390074;Mar 16, 2012 18:05:10.040000000 EDT;192.168.204.60;38419;192.168.202.78;80;6;52;TCP;[TCP Dup ACK 2390072#1] 38419 → 80 [ACK] Seq=495 Ack=103374169 Win=524280 Len=0 TSval=470476199 TSecr=38958022
2390075;Mar 16, 2012 18:05:10.040000000 EDT;192.168.204.60;38419;192.168.202.78;80;6;52;TCP;38419 → 80 [ACK] Seq=495 Ack=103382857 Win=524280 Len=0 TSval=470476199 TSecr=38958026
2390076;Mar 16, 2012 18:05:10.040000000 EDT;192.168.204.60;38419;192.168.202.78;80;6;52;TCP;[TCP Dup ACK 2390075#1] 38419 → 80 [ACK] Seq=495 Ack=103382857 Win=524280 Len=0 TSval=470476199 TSecr=38958026
2390077;Mar 16, 2012 18:05:10.040000000 EDT;192.168.202.78;80;192.168.204.60;38419;6;1500;TCP;80 → 38419 [ACK] Seq=103802777 Ack=495 Win=6912 Len=1448 TSval=38958084 TSecr=470476195 [TCP segment of a reassembled PDU]
2390078;Mar 16, 2012 18:05:10.040000000 EDT;192.168.202.78;80;192.168.204.60;38419;6;1500;TCP;[TCP Retransmission] 80 → 38419 [ACK] Seq=103802777 Ack=495 Win=6912 Len=1448 TSval=38958084 TSecr=470476195
2390079;Mar 16, 2012 18:05:10.040000000 EDT;192.168.204.60;38419;192.168.202.78;80;6;52;TCP;38419 → 80 [ACK] Seq=495 Ack=103385753 Win=524280 Len=0 TSval=470476200 TSecr=38958026
2390080;Mar 16, 2012 18:05:10.040000000 EDT;192.168.204.60;38419;192.168.202.78;80;6;52;TCP;[TCP Dup ACK 2390079#1] 38419 → 80 [ACK] Seq=495 Ack=103385753 Win=524280 Len=0 TSval=470476200 TSecr=38958026
2390081;Mar 16, 2012 18:05:10.040000000 EDT;192.168.202.78;80;192.168.204.60;38419;6;1500;TCP;80 → 38419 [ACK] Seq=103804225 Ack=495 Win=6912 Len=1448 TSval=38958084 TSecr=470476195 [TCP segment of a reassembled PDU]
2390082;Mar 16, 2012 18:05:10.040000000 EDT;192.168.202.78;80;192.168.204.60;38419;6;1500;TCP;[TCP Retransmission] 80 → 38419 [ACK] Seq=103804225 Ack=495 Win=6912 Len=1448 TSval=38958084 TSecr=470476195
2390083;Mar 16, 2012 18:05:10.040000000 EDT;192.168.202.78;80;192.168.204.60;38419;6;1500;TCP;80 → 38419 [ACK] Seq=103805673 Ack=495 Win=6912 Len=1448 TSval=38958084 TSecr=470476195 [TCP segment of a reassembled PDU]
2390084;Mar 16, 2012 18:05:10.040000000 EDT;192.168.202.78;80;192.168.204.60;38419;6;1500;TCP;[TCP Retransmission] 80 → 38419 [ACK] Seq=103805673 Ack=495 Win=6912 Len=1448 TSval=38958084 TSecr=470476195
2390085;Mar 16, 2012 18:05:10.040000000 EDT;192.168.202.78;80;192.168.204.60;38419;6;1500;TCP;80 → 38419 [ACK] Seq=103807121 Ack=495 Win=6912 Len=1448 TSval=38958084 TSecr=470476195 [TCP segment of a reassembled PDU]
2390086;Mar 16, 2012 18:05:10.040000000 EDT;192.168.202.78;80;192.168.204.60;38419;6;1500;TCP;[TCP Retransmission] 80 → 38419 [ACK] Seq=103807121 Ack=495 Win=6912 Len=1448 TSval=38958084 TSecr=470476195
2390087;Mar 16, 2012 18:05:10.040000000 EDT;192.168.202.78;80;192.168.204.60;38419;6;1500;TCP;80 → 38419 [ACK] Seq=103808569 Ack=495 Win=6912 Len=1448 TSval=38958084 TSecr=470476195 [TCP segment of a reassembled PDU]
2390088;Mar 16, 2012 18:05:10.040000000 EDT;192.168.202.78;80;192.168.204.60;38419;6;1500;TCP;[TCP Retransmission] 80 → 38419 [ACK] Seq=103808569 Ack=495 Win=6912 Len=1448 TSval=38958084 TSecr=470476195
2390089;Mar 16, 2012 18:05:10.040000000 EDT;192.168.202.78;80;192.168.204.60;38419;6;1500;TCP;80 → 38419 [ACK] Seq=103810017 Ack=495 Win=6912 Len=1448 TSval=38958084 TSecr=470476195 [TCP segment of a reassembled PDU]
2390090;Mar 16, 2012 18:05:10.040000000 EDT;192.168.202.78;80;192.168.204.60;38419;6;1500;TCP;[TCP Retransmission] 80 → 38419 [ACK] Seq=103810017 Ack=495 Win=6912 Len=1448 TSval=38958084 TSecr=470476195
2390091;Mar 16, 2012 18:05:10.040000000 EDT;192.168.202.78;80;192.168.204.60;38419;6;1500;TCP;80 → 38419 [ACK] Seq=103811465 Ack=495 Win=6912 Len=1448 TSval=38958084 TSecr=470476195 [TCP segment of a reassembled PDU]
2390092;Mar 16, 2012 18:05:10.040000000 EDT;192.168.202.78;80;192.168.204.60;38419;6;1500;TCP;[TCP Retransmission] 80 → 38419 [ACK] Seq=103811465 Ack=495 Win=6912 Len=1448 TSval=38958084 TSecr=470476195
2390093;Mar 16, 2012 18:05:10.040000000 EDT;192.168.202.78;80;192.168.204.60;38419;6;1500;TCP;80 → 38419 [ACK] Seq=103812913 Ack=495 Win=6912 Len=1448 TSval=38958084 TSecr=470476195 [TCP segment of a reassembled PDU]
2390094;Mar 16, 2012 18:05:10.040000000 EDT;192.168.202.78;80;192.168.204.60;38419;6;1500;TCP;[TCP Retransmission] 80 → 38419 [ACK] Seq=103812913 Ack=495 Win=6912 Len=1448 TSval=38958084 TSecr=470476195
2390095;Mar 16, 2012 18:05:10.040000000 EDT;192.168.202.78;80;192.168.204.60;38419;6;1500;TCP;80 → 38419 [ACK] Seq=103814361 Ack=495 Win=6912 Len=1448 TSval=38958084 TSecr=470476195 [TCP segment of a reassembled PDU]
2390096;Mar 16, 2012 18:05:10.040000000 EDT;192.168.202.78;80;192.168.204.60;38419;6;1500;TCP;[TCP Retransmission] 80 → 38419 [ACK] Seq=103814361 Ack=495 Win=6912 Len=1448 TSval=38958084 TSecr=470476195
2390097;Mar 16, 2012 18:05:10.040000000 EDT;192.168.202.78;80;192.168.204.60;38419;6;1500;TCP;80 → 38419 [ACK] Seq=103815809 Ack=495 Win=6912 Len=1448 TSval=38958084 TSecr=470476195 [TCP segment of a reassembled PDU]
2390098;Mar 16, 2012 18:05:10.040000000 EDT;192.168.202.78;80;192.168.204.60;38419;6;1500;TCP;[TCP Retransmission] 80 → 38419 [ACK] Seq=103815809 Ack=495 Win=6912 Len=1448 TSval=38958084 TSecr=470476195
2390099;Mar 16, 2012 18:05:10.040000000 EDT;192.168.202.78;80;192.168.204.60;38419;6;1500;TCP;80 → 38419 [ACK] Seq=103817257 Ack=495 Win=6912 Len=1448 TSval=38958084 TSecr=470476195 [TCP segment of a reassembled PDU]
2390100;Mar 16, 2012 18:05:10.040000000 EDT;192.168.202.78;80;192.168.204.60;38419;6;1500;TCP;[TCP Retransmission] 80 → 38419 [ACK] Seq=103817257 Ack=495 Win=6912 Len=1448 TSval=38958084 TSecr=470476195
2390101;Mar 16, 2012 18:05:10.040000000 EDT;192.168.202.78;80;192.168.204.60;38419;6;1500;TCP;80 → 38419 [ACK] Seq=103818705 Ack=495 Win=6912 Len=1448 TSval=38958084 TSecr=470476195 [TCP segment of a reassembled PDU]
2390102;Mar 16, 2012 18:05:10.040000000 EDT;192.168.202.78;80;192.168.204.60;38419;6;1500;TCP;[TCP Retransmission] 80 → 38419 [ACK] Seq=103818705 Ack=495 Win=6912 Len=1448 TSval=38958084 TSecr=470476195
2390103;Mar 16, 2012 18:05:10.040000000 EDT;192.168.202.78;80;192.168.204.60;38419;6;1500;TCP;80 → 38419 [ACK] Seq=103820153 Ack=495 Win=6912 Len=1448 TSval=38958084 TSecr=470476195 [TCP segment of a reassembled PDU]
2390104;Mar 16, 2012 18:05:10.040000000 EDT;192.168.202.78;80;192.168.204.60;38419;6;1500;TCP;[TCP Retransmission] 80 → 38419 [ACK] Seq=103820153 Ack=495 Win=6912 Len=1448 TSval=38958084 TSecr=470476195
2390105;Mar 16, 2012 18:05:10.040000000 EDT;192.168.202.78;80;192.168.204.60;38419;6;1500;TCP;80 → 38419 [ACK] Seq=103821601 Ack=495 Win=6912 Len=1448 TSval=38958084 TSecr=470476195 [TCP segment of a reassembled PDU]
2390106;Mar 16, 2012 18:05:10.040000000 EDT;192.168.202.78;80;192.168.204.60;38419;6;1500;TCP;[TCP Retransmission] 80 → 38419 [ACK] Seq=103821601 Ack=495 Win=6912 Len=1448 TSval=38958084 TSecr=470476195
2390107;Mar 16, 2012 18:05:10.040000000 EDT;192.168.202.78;80;192.168.204.60;38419;6;1500;TCP;80 → 38419 [ACK] Seq=103823049 Ack=495 Win=6912 Len=1448 TSval=38958084 TSecr=470476195 [TCP segment of a reassembled PDU]
2390108;Mar 16, 2012 18:05:10.040000000 EDT;192.168.202.78;80;192.168.204.60;38419;6;1500;TCP;[TCP Retransmission] 80 → 38419 [ACK] Seq=103823049 Ack=495 Win=6912 Len=1448 TSval=38958084 TSecr=470476195
2390109;Mar 16, 2012 18:05:10.040000000 EDT;192.168.202.78;80;192.168.204.60;38419;6;1500;TCP;80 → 38419 [ACK] Seq=103824497 Ack=495 Win=6912 Len=1448 TSval=38958084 TSecr=470476195 [TCP segment of a reassembled PDU]
2390110;Mar 16, 2012 18:05:10.040000000 EDT;192.168.202.78;80;192.168.204.60;38419;6;1500;TCP;[TCP Retransmission] 80 → 38419 [ACK] Seq=103824497 Ack=495 Win=6912 Len=1448 TSval=38958084 TSecr=470476195
2390111;Mar 16, 2012 18:05:10.040000000 EDT;192.168.202.78;80;192.168.204.60;38419;6;1500;TCP;80 → 38419 [ACK] Seq=103825945 Ack=495 Win=6912 Len=1448 TSval=38958084 TSecr=470476195 [TCP segment of a reassembled PDU]
2390112;Mar 16, 2012 18:05:10.040000000 EDT;192.168.202.78;80;192.168.204.60;38419;6;1500;TCP;[TCP Retransmission] 80 → 38419 [ACK] Seq=103825945 Ack=495 Win=6912 Len=1448 TSval=38958084 TSecr=470476195
2390113;Mar 16, 2012 18:05:10.040000000 EDT;192.168.202.78;80;192.168.204.60;38419;6;1500;TCP;80 → 38419 [ACK] Seq=103827393 Ack=495 Win=6912 Len=1448 TSval=38958084 TSecr=470476195 [TCP segment of a reassembled PDU]
2390114;Mar 16, 2012 18:05:10.040000000 EDT;192.168.202.78;80;192.168.204.60;38419;6;1500;TCP;[TCP Retransmission] 80 → 38419 [ACK] Seq=103827393 Ack=495 Win=6912 Len=1448 TSval=38958084 TSecr=470476195
2390115;Mar 16, 2012 18:05:10.040000000 EDT;192.168.202.78;80;192.168.204.60;38419;6;1500;TCP;80 → 38419 [ACK] Seq=103828841 Ack=495 Win=6912 Len=1448 TSval=38958084 TSecr=470476195 [TCP segment of a reassembled PDU]
2390116;Mar 16, 2012 18:05:10.040000000 EDT;192.168.202.78;80;192.168.204.60;38419;6;1500;TCP;[TCP Retransmission] 80 → 38419 [ACK] Seq=103828841 Ack=495 Win=6912 Len=1448 TSval=38958084 TSecr=470476195
2390117;Mar 16, 2012 18:05:10.040000000 EDT;192.168.202.78;80;192.168.204.60;38419;6;1500;TCP;80 → 38419 [ACK] Seq=103830289 Ack=495 Win=6912 Len=1448 TSval=38958084 TSecr=470476195 [TCP segment of a reassembled PDU]
2390118;Mar 16, 2012 18:05:10.040000000 EDT;192.168.202.78;80;192.168.204.60;38419;6;1500;TCP;[TCP Retransmission] 80 → 38419 [ACK] Seq=103830289 Ack=495 Win=6912 Len=1448 TSval=38958084 TSecr=470476195
2390119;Mar 16, 2012 18:05:10.040000000 EDT;192.168.202.78;80;192.168.204.60;38419;6;1500;TCP;80 → 38419 [ACK] Seq=103831737 Ack=495 Win=6912 Len=1448 TSval=38958084 TSecr=470476195 [TCP segment of a reassembled PDU]
2390120;Mar 16, 2012 18:05:10.040000000 EDT;192.168.202.78;80;192.168.204.60;38419;6;1500;TCP;[TCP Retransmission] 80 → 38419 [ACK] Seq=103831737 Ack=495 Win=6912 Len=1448 TSval=38958084 TSecr=470476195
2390121;Mar 16, 2012 18:05:10.040000000 EDT;192.168.204.60;38419;192.168.202.78;80;6;52;TCP;38419 → 80 [ACK] Seq=495 Ack=103391545 Win=524280 Len=0 TSval=470476200 TSecr=38958026
2390122;Mar 16, 2012 18:05:10.040000000 EDT;192.168.204.60;38419;192.168.202.78;80;6;52;TCP;[TCP Dup ACK 2390121#1] 38419 → 80 [ACK] Seq=495 Ack=103391545 Win=524280 Len=0 TSval=470476200 TSecr=38958026
2390123;Mar 16, 2012 18:05:10.040000000 EDT;192.168.204.60;38419;192.168.202.78;80;6;52;TCP;38419 → 80 [ACK] Seq=495 Ack=103394441 Win=524280 Len=0 TSval=470476201 TSecr=38958026
2390124;Mar 16, 2012 18:05:10.040000000 EDT;192.168.204.60;38419;192.168.202.78;80;6;52;TCP;[TCP Dup ACK 2390123#1] 38419 → 80 [ACK] Seq=495 Ack=103394441 Win=524280 Len=0 TSval=470476201 TSecr=38958026
2390125;Mar 16, 2012 18:05:10.040000000 EDT;192.168.204.60;38419;192.168.202.78;80;6;52;TCP;38419 → 80 [ACK] Seq=495 Ack=103400233 Win=524280 Len=0 TSval=470476201 TSecr=38958026
2390126;Mar 16, 2012 18:05:10.040000000 EDT;192.168.204.60;38419;192.168.202.78;80;6;52;TCP;[TCP Dup ACK 2390125#1] 38419 → 80 [ACK] Seq=495 Ack=103400233 Win=524280 Len=0 TSval=470476201 TSecr=38958026
2390127;Mar 16, 2012 18:05:10.040000000 EDT;192.168.204.60;38419;192.168.202.78;80;6;52;TCP;38419 → 80 [ACK] Seq=495 Ack=103407473 Win=524280 Len=0 TSval=470476202 TSecr=38958027
2390128;Mar 16, 2012 18:05:10.040000000 EDT;192.168.204.60;38419;192.168.202.78;80;6;52;TCP;[TCP Dup ACK 2390127#1] 38419 → 80 [ACK] Seq=495 Ack=103407473 Win=524280 Len=0 TSval=470476202 TSecr=38958027
2390129;Mar 16, 2012 18:05:10.040000000 EDT;192.168.204.60;38419;192.168.202.78;80;6;52;TCP;38419 → 80 [ACK] Seq=495 Ack=103410369 Win=524280 Len=0 TSval=470476203 TSecr=38958027
2390130;Mar 16, 2012 18:05:10.040000000 EDT;192.168.204.60;38419;192.168.202.78;80;6;52;TCP;[TCP Dup ACK 2390129#1] 38419 → 80 [ACK] Seq=495 Ack=103410369 Win=524280 Len=0 TSval=470476203 TSecr=38958027
2390131;Mar 16, 2012 18:05:10.040000000 EDT;192.168.204.60;38419;192.168.202.78;80;6;52;TCP;38419 → 80 [ACK] Seq=495 Ack=103419057 Win=524280 Len=0 TSval=470476203 TSecr=38958027
2390132;Mar 16, 2012 18:05:10.040000000 EDT;192.168.204.60;38419;192.168.202.78;80;6;52;TCP;[TCP Dup ACK 2390131#1] 38419 → 80 [ACK] Seq=495 Ack=103419057 Win=524280 Len=0 TSval=470476203 TSecr=38958027
2390133;Mar 16, 2012 18:05:10.040000000 EDT;192.168.204.60;38419;192.168.202.78;80;6;52;TCP;38419 → 80 [ACK] Seq=495 Ack=103421953 Win=524280 Len=0 TSval=470476204 TSecr=38958027
2390134;Mar 16, 2012 18:05:10.040000000 EDT;192.168.204.60;38419;192.168.202.78;80;6;52;TCP;[TCP Dup ACK 2390133#1] 38419 → 80 [ACK] Seq=495 Ack=103421953 Win=524280 Len=0 TSval=470476204 TSecr=38958027
2390135;Mar 16, 2012 18:05:10.040000000 EDT;192.168.204.60;38419;192.168.202.78;80;6;52;TCP;38419 → 80 [ACK] Seq=495 Ack=103427745 Win=524280 Len=0 TSval=470476204 TSecr=38958027
2390136;Mar 16, 2012 18:05:10.040000000 EDT;192.168.204.60;38419;192.168.202.78;80;6;52;TCP;[TCP Dup ACK 2390135#1] 38419 → 80 [ACK] Seq=495 Ack=103427745 Win=524280 Len=0 TSval=470476204 TSecr=38958027
2390137;Mar 16, 2012 18:05:10.040000000 EDT;192.168.204.60;38419;192.168.202.78;80;6;52;TCP;38419 → 80 [ACK] Seq=495 Ack=103430641 Win=524280 Len=0 TSval=470476204 TSecr=38958027
2390138;Mar 16, 2012 18:05:10.040000000 EDT;192.168.204.60;38419;192.168.202.78;80;6;52;TCP;[TCP Dup ACK 2390137#1] 38419 → 80 [ACK] Seq=495 Ack=103430641 Win=524280 Len=0 TSval=470476204 TSecr=38958027
2390139;Mar 16, 2012 18:05:10.040000000 EDT;192.168.204.60;38419;192.168.202.78;80;6;52;TCP;38419 → 80 [ACK] Seq=495 Ack=103433537 Win=524280 Len=0 TSval=470476205 TSecr=38958027
2390140;Mar 16, 2012 18:05:10.040000000 EDT;192.168.204.60;38419;192.168.202.78;80;6;52;TCP;[TCP Dup ACK 2390139#1] 38419 → 80 [ACK] Seq=495 Ack=103433537 Win=524280 Len=0 TSval=470476205 TSecr=38958027
2390141;Mar 16, 2012 18:05:10.050000000 EDT;192.168.202.78;80;192.168.204.60;38419;6;1500;TCP;80 → 38419 [ACK] Seq=103833185 Ack=495 Win=6912 Len=1448 TSval=38958092 TSecr=470476200 [TCP segment of a reassembled PDU]
2390142;Mar 16, 2012 18:05:10.050000000 EDT;192.168.202.78;80;192.168.204.60;38419;6;1500;TCP;[TCP Retransmission] 80 → 38419 [ACK] Seq=103833185 Ack=495 Win=6912 Len=1448 TSval=38958092 TSecr=470476200
2390143;Mar 16, 2012 18:05:10.050000000 EDT;192.168.202.78;80;192.168.204.60;38419;6;1500;TCP;80 → 38419 [ACK] Seq=103834633 Ack=495 Win=6912 Len=1448 TSval=38958092 TSecr=470476200 [TCP segment of a reassembled PDU]
2390144;Mar 16, 2012 18:05:10.050000000 EDT;192.168.202.78;80;192.168.204.60;38419;6;1500;TCP;[TCP Retransmission] 80 → 38419 [ACK] Seq=103834633 Ack=495 Win=6912 Len=1448 TSval=38958092 TSecr=470476200
2390145;Mar 16, 2012 18:05:10.050000000 EDT;192.168.202.78;80;192.168.204.60;38419;6;1500;TCP;80 → 38419 [ACK] Seq=103836081 Ack=495 Win=6912 Len=1448 TSval=38958092 TSecr=470476200 [TCP segment of a reassembled PDU]
2390146;Mar 16, 2012 18:05:10.050000000 EDT;192.168.202.78;80;192.168.204.60;38419;6;1500;TCP;[TCP Retransmission] 80 → 38419 [ACK] Seq=103836081 Ack=495 Win=6912 Len=1448 TSval=38958092 TSecr=470476200
2390147;Mar 16, 2012 18:05:10.050000000 EDT;192.168.202.78;80;192.168.204.60;38419;6;1500;TCP;80 → 38419 [ACK] Seq=103837529 Ack=495 Win=6912 Len=1448 TSval=38958092 TSecr=470476200 [TCP segment of a reassembled PDU]
2390148;Mar 16, 2012 18:05:10.050000000 EDT;192.168.202.78;80;192.168.204.60;38419;6;1500;TCP;[TCP Retransmission] 80 → 38419 [ACK] Seq=103837529 Ack=495 Win=6912 Len=1448 TSval=38958092 TSecr=470476200
2390149;Mar 16, 2012 18:05:10.050000000 EDT;192.168.202.78;80;192.168.204.60;38419;6;1500;TCP;80 → 38419 [ACK] Seq=103838977 Ack=495 Win=6912 Len=1448 TSval=38958092 TSecr=470476200 [TCP segment of a reassembled PDU]
2390150;Mar 16, 2012 18:05:10.050000000 EDT;192.168.202.78;80;192.168.204.60;38419;6;1500;TCP;[TCP Retransmission] 80 → 38419 [ACK] Seq=103838977 Ack=495 Win=6912 Len=1448 TSval=38958092 TSecr=470476200
2390151;Mar 16, 2012 18:05:10.050000000 EDT;192.168.202.78;80;192.168.204.60;38419;6;1500;TCP;80 → 38419 [ACK] Seq=103840425 Ack=495 Win=6912 Len=1448 TSval=38958092 TSecr=470476200 [TCP segment of a reassembled PDU]
2390152;Mar 16, 2012 18:05:10.050000000 EDT;192.168.202.78;80;192.168.204.60;38419;6;1500;TCP;[TCP Retransmission] 80 → 38419 [ACK] Seq=103840425 Ack=495 Win=6912 Len=1448 TSval=38958092 TSecr=470476200
2390153;Mar 16, 2012 18:05:10.050000000 EDT;192.168.202.78;80;192.168.204.60;38419;6;1500;TCP;80 → 38419 [ACK] Seq=103841873 Ack=495 Win=6912 Len=1448 TSval=38958092 TSecr=470476200 [TCP segment of a reassembled PDU]
2390154;Mar 16, 2012 18:05:10.050000000 EDT;192.168.202.78;80;192.168.204.60;38419;6;1500;TCP;[TCP Retransmission] 80 → 38419 [ACK] Seq=103841873 Ack=495 Win=6912 Len=1448 TSval=38958092 TSecr=470476200
2390155;Mar 16, 2012 18:05:10.050000000 EDT;192.168.202.78;80;192.168.204.60;38419;6;1500;TCP;80 → 38419 [ACK] Seq=103843321 Ack=495 Win=6912 Len=1448 TSval=38958092 TSecr=470476200 [TCP segment of a reassembled PDU]
2390156;Mar 16, 2012 18:05:10.050000000 EDT;192.168.202.78;80;192.168.204.60;38419;6;1500;TCP;[TCP Retransmission] 80 → 38419 [ACK] Seq=103843321 Ack=495 Win=6912 Len=1448 TSval=38958092 TSecr=470476200
2390157;Mar 16, 2012 18:05:10.050000000 EDT;192.168.202.78;80;192.168.204.60;38419;6;1500;TCP;80 → 38419 [ACK] Seq=103844769 Ack=495 Win=6912 Len=1448 TSval=38958092 TSecr=470476200 [TCP segment of a reassembled PDU]
2390158;Mar 16, 2012 18:05:10.050000000 EDT;192.168.202.78;80;192.168.204.60;38419;6;1500;TCP;[TCP Retransmission] 80 → 38419 [ACK] Seq=103844769 Ack=495 Win=6912 Len=1448 TSval=38958092 TSecr=470476200
2390159;Mar 16, 2012 18:05:10.050000000 EDT;192.168.202.78;80;192.168.204.60;38419;6;1500;TCP;80 → 38419 [ACK] Seq=103846217 Ack=495 Win=6912 Len=1448 TSval=38958092 TSecr=470476200 [TCP segment of a reassembled PDU]
2390160;Mar 16, 2012 18:05:10.050000000 EDT;192.168.202.78;80;192.168.204.60;38419;6;1500;TCP;[TCP Retransmission] 80 → 38419 [ACK] Seq=103846217 Ack=495 Win=6912 Len=1448 TSval=38958092 TSecr=470476200
2390161;Mar 16, 2012 18:05:10.050000000 EDT;192.168.202.78;80;192.168.204.60;38419;6;1500;TCP;80 → 38419 [ACK] Seq=103847665 Ack=495 Win=6912 Len=1448 TSval=38958092 TSecr=470476200 [TCP segment of a reassembled PDU]
2390162;Mar 16, 2012 18:05:10.050000000 EDT;192.168.202.78;80;192.168.204.60;38419;6;1500;TCP;[TCP Retransmission] 80 → 38419 [ACK] Seq=103847665 Ack=495 Win=6912 Len=1448 TSval=38958092 TSecr=470476200
2390163;Mar 16, 2012 18:05:10.050000000 EDT;192.168.202.78;80;192.168.204.60;38419;6;1500;TCP;80 → 38419 [ACK] Seq=103849113 Ack=495 Win=6912 Len=1448 TSval=38958092 TSecr=470476200 [TCP segment of a reassembled PDU]
2390164;Mar 16, 2012 18:05:10.050000000 EDT;192.168.202.78;80;192.168.204.60;38419;6;1500;TCP;[TCP Retransmission] 80 → 38419 [ACK] Seq=103849113 Ack=495 Win=6912 Len=1448 TSval=38958092 TSecr=470476200
2390165;Mar 16, 2012 18:05:10.050000000 EDT;192.168.202.78;80;192.168.204.60;38419;6;1500;TCP;80 → 38419 [ACK] Seq=103850561 Ack=495 Win=6912 Len=1448 TSval=38958092 TSecr=470476200 [TCP segment of a reassembled PDU]
2390166;Mar 16, 2012 18:05:10.050000000 EDT;192.168.202.78;80;192.168.204.60;38419;6;1500;TCP;[TCP Retransmission] 80 → 38419 [ACK] Seq=103850561 Ack=495 Win=6912 Len=1448 TSval=38958092 TSecr=470476200
2390167;Mar 16, 2012 18:05:10.050000000 EDT;192.168.202.78;80;192.168.204.60;38419;6;1500;TCP;80 → 38419 [ACK] Seq=103852009 Ack=495 Win=6912 Len=1448 TSval=38958092 TSecr=470476200 [TCP segment of a reassembled PDU]
2390168;Mar 16, 2012 18:05:10.050000000 EDT;192.168.202.78;80;192.168.204.60;38419;6;1500;TCP;[TCP Retransmission] 80 → 38419 [ACK] Seq=103852009 Ack=495 Win=6912 Len=1448 TSval=38958092 TSecr=470476200
2390169;Mar 16, 2012 18:05:10.050000000 EDT;192.168.202.78;80;192.168.204.60;38419;6;1500;TCP;80 → 38419 [ACK] Seq=103853457 Ack=495 Win=6912 Len=1448 TSval=38958092 TSecr=470476200 [TCP segment of a reassembled PDU]
2390170;Mar 16, 2012 18:05:10.050000000 EDT;192.168.202.78;80;192.168.204.60;38419;6;1500;TCP;[TCP Retransmission] 80 → 38419 [ACK] Seq=103853457 Ack=495 Win=6912 Len=1448 TSval=38958092 TSecr=470476200
2390171;Mar 16, 2012 18:05:10.050000000 EDT;192.168.202.78;80;192.168.204.60;38419;6;1500;TCP;80 → 38419 [ACK] Seq=103854905 Ack=495 Win=6912 Len=1448 TSval=38958092 TSecr=470476200 [TCP segment of a reassembled PDU]
2390172;Mar 16, 2012 18:05:10.050000000 EDT;192.168.202.78;80;192.168.204.60;38419;6;1500;TCP;[TCP Retransmission] 80 → 38419 [ACK] Seq=103854905 Ack=495 Win=6912 Len=1448 TSval=38958092 TSecr=470476200
2390173;Mar 16, 2012 18:05:10.050000000 EDT;192.168.202.78;80;192.168.204.60;38419;6;1500;TCP;80 → 38419 [ACK] Seq=103856353 Ack=495 Win=6912 Len=1448 TSval=38958092 TSecr=470476200 [TCP segment of a reassembled PDU]
2390174;Mar 16, 2012 18:05:10.050000000 EDT;192.168.202.78;80;192.168.204.60;38419;6;1500;TCP;[TCP Retransmission] 80 → 38419 [ACK] Seq=103856353 Ack=495 Win=6912 Len=1448 TSval=38958092 TSecr=470476200
2390175;Mar 16, 2012 18:05:10.050000000 EDT;192.168.202.78;80;192.168.204.60;38419;6;1500;TCP;80 → 38419 [ACK] Seq=103857801 Ack=495 Win=6912 Len=1448 TSval=38958092 TSecr=470476200 [TCP segment of a reassembled PDU]
2390176;Mar 16, 2012 18:05:10.050000000 EDT;192.168.202.78;80;192.168.204.60;38419;6;1500;TCP;[TCP Retransmission] 80 → 38419 [ACK] Seq=103857801 Ack=495 Win=6912 Len=1448 TSval=38958092 TSecr=470476200
2390177;Mar 16, 2012 18:05:10.050000000 EDT;192.168.202.78;80;192.168.204.60;38419;6;1500;TCP;80 → 38419 [ACK] Seq=103859249 Ack=495 Win=6912 Len=1448 TSval=38958092 TSecr=470476200 [TCP segment of a reassembled PDU]
2390178;Mar 16, 2012 18:05:10.050000000 EDT;192.168.202.78;80;192.168.204.60;38419;6;1500;TCP;[TCP Retransmission] 80 → 38419 [ACK] Seq=103859249 Ack=495 Win=6912 Len=1448 TSval=38958092 TSecr=470476200
2390179;Mar 16, 2012 18:05:10.050000000 EDT;192.168.202.78;80;192.168.204.60;38419;6;1500;TCP;80 → 38419 [ACK] Seq=103860697 Ack=495 Win=6912 Len=1448 TSval=38958092 TSecr=470476200 [TCP segment of a reassembled PDU]
2390180;Mar 16, 2012 18:05:10.050000000 EDT;192.168.202.78;80;192.168.204.60;38419;6;1500;TCP;[TCP Retransmission] 80 → 38419 [ACK] Seq=103860697 Ack=495 Win=6912 Len=1448 TSval=38958092 TSecr=470476200
2390181;Mar 16, 2012 18:05:10.050000000 EDT;192.168.202.78;80;192.168.204.60;38419;6;1500;TCP;80 → 38419 [ACK] Seq=103862145 Ack=495 Win=6912 Len=1448 TSval=38958092 TSecr=470476200 [TCP segment of a reassembled PDU]
2390182;Mar 16, 2012 18:05:10.050000000 EDT;192.168.202.78;80;192.168.204.60;38419;6;1500;TCP;[TCP Retransmission] 80 → 38419 [ACK] Seq=103862145 Ack=495 Win=6912 Len=1448 TSval=38958092 TSecr=470476200
2390183;Mar 16, 2012 18:05:10.050000000 EDT;192.168.202.78;80;192.168.204.60;38419;6;1500;TCP;80 → 38419 [ACK] Seq=103863593 Ack=495 Win=6912 Len=1448 TSval=38958092 TSecr=470476200 [TCP segment of a reassembled PDU]
2390184;Mar 16, 2012 18:05:10.050000000 EDT;192.168.202.78;80;192.168.204.60;38419;6;1500;TCP;[TCP Retransmission] 80 → 38419 [ACK] Seq=103863593 Ack=495 Win=6912 Len=1448 TSval=38958092 TSecr=470476200
2390185;Mar 16, 2012 18:05:10.050000000 EDT;192.168.202.78;80;192.168.204.60;38419;6;1500;TCP;80 → 38419 [ACK] Seq=103865041 Ack=495 Win=6912 Len=1448 TSval=38958092 TSecr=470476200 [TCP segment of a reassembled PDU]
2390186;Mar 16, 2012 18:05:10.050000000 EDT;192.168.202.78;80;192.168.204.60;38419;6;1500;TCP;[TCP Retransmission] 80 → 38419 [ACK] Seq=103865041 Ack=495 Win=6912 Len=1448 TSval=38958092 TSecr=470476200
2390187;Mar 16, 2012 18:05:10.050000000 EDT;192.168.202.78;80;192.168.204.60;38419;6;1500;TCP;80 → 38419 [ACK] Seq=103866489 Ack=495 Win=6912 Len=1448 TSval=38958092 TSecr=470476200 [TCP segment of a reassembled PDU]
2390188;Mar 16, 2012 18:05:10.050000000 EDT;192.168.202.78;80;192.168.204.60;38419;6;1500;TCP;[TCP Retransmission] 80 → 38419 [ACK] Seq=103866489 Ack=495 Win=6912 Len=1448 TSval=38958092 TSecr=470476200
2390189;Mar 16, 2012 18:05:10.050000000 EDT;192.168.202.78;80;192.168.204.60;38419;6;1500;TCP;80 → 38419 [ACK] Seq=103867937 Ack=495 Win=6912 Len=1448 TSval=38958092 TSecr=470476200 [TCP segment of a reassembled PDU]
2390190;Mar 16, 2012 18:05:10.050000000 EDT;192.168.202.78;80;192.168.204.60;38419;6;1500;TCP;[TCP Retransmission] 80 → 38419 [ACK] Seq=103867937 Ack=495 Win=6912 Len=1448 TSval=38958092 TSecr=470476200
2390191;Mar 16, 2012 18:05:10.050000000 EDT;192.168.202.78;80;192.168.204.60;38419;6;1500;TCP;80 → 38419 [ACK] Seq=103869385 Ack=495 Win=6912 Len=1448 TSval=38958092 TSecr=470476200 [TCP segment of a reassembled PDU]
2390192;Mar 16, 2012 18:05:10.050000000 EDT;192.168.202.78;80;192.168.204.60;38419;6;1500;TCP;[TCP Retransmission] 80 → 38419 [ACK] Seq=103869385 Ack=495 Win=6912 Len=1448 TSval=38958092 TSecr=470476200
2390193;Mar 16, 2012 18:05:10.050000000 EDT;192.168.202.78;80;192.168.204.60;38419;6;1500;TCP;80 → 38419 [ACK] Seq=103870833 Ack=495 Win=6912 Len=1448 TSval=38958092 TSecr=470476200 [TCP segment of a reassembled PDU]
